<?xml version="1.0" encoding="UTF-8"?>
<npc type="Monster" id="18551" xsi:schemaLocation="npc ../../npc.xsd"
    xsi:noNamespaceSchemaLocation="npc" xmlns:xsi="http://www.w3.org/2001/XMLSchema-instance">
    <info aggressive="false" targetable="true" attackable="false">
        <name display="true" send="false">Cruma Phantom</name>
        <title send="false">Event Monster</title>
        <level>50</level>
        <sex>MALE</sex>
        <stats>
            <hp regen="37.2348110463089" max="53155.2086342172"/>
            <mp regen="2.1" max="747.8"/>
            <attack critical="1" evasion="0" range="40">
                <physical speed="253.0" damage="491.12346"/>
                <magical speed="333.0" damage="335.37366"/>
            </attack>
            <defense>
                <physical value="320.3815"/>
                <magical value="351.66192"/>
            </defense>
            <move walk="27.0" run="150.0"/>
            <base wit="20" dex="30" men="20" con="43" str="40" int="21"/>
        </stats>
        <experience>0</experience>
        <sp>0</sp>
        <collision heigth="35.0" radius="20.0"/>
    </info>
</npc>
