<?xml version="1.0" encoding="UTF-8"?>
<npc
    controller="com.l2jserver.model.world.npc.controller.NotImplementedNPCController"
    id="22463" xsi:schemaLocation="npc ../../npc.xsd"
    xsi:noNamespaceSchemaLocation="npc" xmlns:xsi="http://www.w3.org/2001/XMLSchema-instance">
    <info aggressive="false" targetable="true" attackable="true">
        <name display="true" send="false">Gluttonous Kanabion</name>
        <title send="false">Void</title>
        <level>42</level>
        <sex>MALE</sex>
        <stats>
            <hp regen="4.5" max="966.57792"/>
            <mp regen="1.8" max="478.8"/>
            <attack critical="4" evasion="0" range="40">
                <physical speed="253.0" damage="176.36077"/>
                <magical speed="333.0" damage="120.43155"/>
            </attack>
            <defense>
                <physical value="156.55035"/>
                <magical value="114.55675"/>
            </defense>
            <move walk="18.0" run="150.0"/>
            <base wit="20" dex="30" men="20" con="43" str="40" int="21"/>
        </stats>
        <experience>3243</experience>
        <sp>189</sp>
        <item lefthand="0" righthand="5130"/>
        <collision heigth="42.0" radius="26.0"/>
    </info>
    <droplist>
        <item chance="25700" max="1" min="1" id="956"/>
    </droplist>
</npc>
