<?xml version="1.0" encoding="UTF-8"?>
<template:npc
    controller="com.l2jserver.model.world.npc.controller.MonsterController"
    id="22363" xsi:schemaLocation="http://schemas.l2jserver2.com/npc ../../npc.xsd"
    xmlns:xsi="http://www.w3.org/2001/XMLSchema-instance" xmlns:template="http://schemas.l2jserver2.com/npc">
    <info aggressive="true" targetable="true" attackable="true">
        <name display="true" send="false">Body Destroyer</name>
        <level>83</level>
        <race>UNDEAD</race>
        <sex>MALE</sex>
        <stats>
            <hp regen="190.897045965523" max="56202.8420013809"/>
            <mp regen="3.0" max="1777.4"/>
            <attack critical="1" evasion="0" range="40">
                <physical speed="253.0" damage="9440.59974"/>
                <magical speed="333.0" damage="6521.6675"/>
            </attack>
            <defense>
                <physical value="585.59197"/>
                <magical value="642.76618"/>
            </defense>
            <move walk="51.0" run="160.0"/>
            <base wit="20" dex="30" men="20" con="43" str="40" int="21"/>
        </stats>
        <experience>314158</experience>
        <sp>33124</sp>
        <collision heigth="31.5" radius="14.0"/>
    </info>
    <droplist>
        <item chance="700000" category="DROP" max="68413" min="34159" id="57"/>
        <item chance="200000" category="UNK_101" max="1" min="1" id="9685"/>
        <item chance="13130" category="UNK_1" max="1" min="1" id="5545"/>
        <item chance="14422" category="UNK_1" max="1" min="1" id="5546"/>
        <item chance="13130" category="UNK_1" max="1" min="1" id="5529"/>
        <item chance="99749" category="UNK_2" max="9" min="3" id="1879"/>
        <item chance="299247" category="UNK_2" max="1" min="1" id="1885"/>
        <item chance="28164" category="UNK_2" max="1" min="1" id="9628"/>
        <item chance="18900" category="UNK_2" max="1" min="1" id="9630"/>
        <item chance="15613" category="UNK_2" max="1" min="1" id="9629"/>
        <item chance="28727" category="UNK_200" max="1" min="1" id="9551"/>
        <item chance="6367" category="UNK_2" max="1" min="1" id="6861"/>
        <item chance="144" category="UNK_2" max="1" min="1" id="959"/>
        <item chance="46" category="UNK_1" max="1" min="1" id="81"/>
        <item chance="46" category="UNK_1" max="1" min="1" id="151"/>
        <item chance="46" category="UNK_1" max="1" min="1" id="2500"/>
        <item chance="946016" category="SPOIL" max="1" min="1" id="6706"/>
        <item chance="813293" category="SPOIL" max="1" min="1" id="6705"/>
        <item chance="58317" category="SPOIL" max="1" min="1" id="6901"/>
    </droplist>
    <skills>
        <skill level="1" id="4408"/>
        <skill level="1" id="4409"/>
        <skill level="11" id="4410"/>
        <skill level="11" id="4411"/>
        <skill level="11" id="4412"/>
        <skill level="11" id="4413"/>
        <skill level="2" id="4414"/>
        <skill level="5" id="4415"/>
        <skill level="1" id="4416"/>
        <skill level="1" id="5256"/>
        <skill level="1" id="5257"/>
        <skill level="5" id="5334"/>
        <skill level="1" id="5467"/>
    </skills>
</template:npc>
