<?xml version="1.0" encoding="UTF-8"?>
<npc
    controller="com.l2jserver.model.world.npc.controller.MonsterController"
    id="21062" xsi:schemaLocation="npc ../../npc.xsd"
    xmlns:xsi="http://www.w3.org/2001/XMLSchema-instance" xmlns="npc">
    <info aggressive="true" targetable="true" attackable="true">
        <name display="true" send="false">Messenger Angel</name>
        <level>70</level>
        <race>ANGEL</race>
        <sex>MALE</sex>
        <stats>
            <hp regen="7.5" max="2444.46819"/>
            <mp regen="2.7" max="1345.8"/>
            <attack critical="1" evasion="0" range="40">
                <physical speed="253.0" damage="688.86373"/>
                <magical speed="333.0" damage="470.40463"/>
            </attack>
            <defense>
                <physical value="295.91597"/>
                <magical value="197.0242"/>
            </defense>
            <move walk="30.0" run="174.0"/>
            <base wit="20" dex="30" men="20" con="43" str="40" int="21"/>
        </stats>
        <experience>0</experience>
        <sp>0</sp>
        <item lefthand="0" righthand="148"/>
        <collision heigth="36.5" radius="13.5"/>
    </info>
    <skills>
        <skill level="7" id="4033"/>
        <skill level="7" id="4073"/>
        <skill level="1" id="4085"/>
        <skill level="1" id="4086"/>
        <skill level="1" id="4092"/>
        <skill level="12" id="4408"/>
        <skill level="1" id="4409"/>
        <skill level="13" id="4410"/>
        <skill level="13" id="4411"/>
        <skill level="11" id="4412"/>
        <skill level="9" id="4413"/>
        <skill level="2" id="4414"/>
        <skill level="5" id="4415"/>
        <skill level="8" id="4416"/>
    </skills>
</npc>
