<?xml version="1.0" encoding="UTF-8"?>
<npc
    controller="com.l2jserver.model.world.npc.controller.MonsterController"
    id="27193" xsi:schemaLocation="npc ../../npc.xsd"
    xsi:noNamespaceSchemaLocation="npc" xmlns:xsi="http://www.w3.org/2001/XMLSchema-instance">
    <info aggressive="true" targetable="true" attackable="true">
        <name display="true" send="false">Goblin Servant</name>
        <title send="false">Quest Monster</title>
        <level>12</level>
        <sex>MALE</sex>
        <stats>
            <hp regen="2.5" max="199.62322"/>
            <mp regen="1.2" max="124.48"/>
            <attack critical="4" evasion="0" range="40">
                <physical speed="253.0" damage="22.99606"/>
                <magical speed="333.0" damage="15.70333"/>
            </attack>
            <defense>
                <physical value="66.32989"/>
                <magical value="48.53733"/>
            </defense>
            <move walk="40.0" run="120.0"/>
            <base wit="20" dex="30" men="20" con="43" str="40" int="21"/>
        </stats>
        <experience>0</experience>
        <sp>0</sp>
        <collision heigth="16.5" radius="10.0"/>
    </info>
</npc>
