<?xml version="1.0" encoding="UTF-8" standalone="yes"?>
<npc xmlns:xsi="http://www.w3.org/2001/XMLSchema-instance" type="Pet" id="14615" xsi:schemaLocation="npc ../../npc.xsd" xsi:noNamespaceSchemaLocation="npc">
    <info aggressive="false" targetable="true" attackable="false">
        <name display="true" send="false">Soulless</name>
        <level>84</level>
        <sex>MALE</sex>
        <stats>
            <hp regen="8.5" max="3032.639435"/>
            <mp regen="3.0" max="1829.3"/>
            <attack critical="4" evasion="0" range="40">
                <physical speed="253.0" damage="975.16116"/>
                <magical speed="333.0" damage="665.90866"/>
            </attack>
            <defense>
                <physical value="359.87013"/>
                <magical value="263.33734"/>
            </defense>
            <move walk="48.0" run="180.0"/>
            <base wit="20" dex="30" men="25" con="43" str="40" int="21"/>
        </stats>
        <experience>0</experience>
        <sp>0</sp>
        <collision heigth="28.0" radius="7.0"/>
    </info>
</npc>
