<?xml version="1.0" encoding="UTF-8"?>
<template:npc
    controller="com.l2jserver.model.world.npc.controller.impl.NotImplementedNPCController"
    id="18070" xsi:schemaLocation="http://schemas.l2jserver2.com/npc ../../npc.xsd"
    xmlns:xsi="http://www.w3.org/2001/XMLSchema-instance" xmlns:template="http://schemas.l2jserver2.com/npc">
    <info aggressive="false" targetable="true" attackable="true">
        <name display="true" send="false">Apostate's Offering</name>
        <level>43</level>
        <race>HUMANOID</race>
        <sex>MALE</sex>
        <stats>
            <hp regen="5.5" max="1094.28943"/>
            <mp regen="2.1" max="557.4"/>
            <attack critical="8" evasion="0" range="40">
                <physical speed="253.0" damage="183.79228"/>
                <magical speed="333.0" damage="143.43577"/>
            </attack>
            <defense>
                <physical value="143.76404"/>
                <magical value="102.45795"/>
            </defense>
            <move walk="45.0" run="30.0"/>
            <base wit="20" dex="30" men="20" con="43" str="40" int="21"/>
        </stats>
        <experience>2751</experience>
        <sp>186</sp>
        <item leftHand="0" rightHand="223"/>
        <collision heigth="22.0" radius="12.0"/>
    </info>
    <droplist>
        <item chance="700000" category="DROP" max="611" min="305" id="57"/>
    </droplist>
    <skills>
        <skill level="1" id="4408"/>
        <skill level="1" id="4409"/>
        <skill level="11" id="4410"/>
        <skill level="11" id="4411"/>
        <skill level="11" id="4412"/>
        <skill level="11" id="4413"/>
        <skill level="3" id="4414"/>
        <skill level="7" id="4415"/>
        <skill level="6" id="4416"/>
        <skill level="2" id="4438"/>
        <skill level="2" id="4439"/>
        <skill level="2" id="4444"/>
        <skill level="2" id="4445"/>
    </skills>
</template:npc>
