<?xml version="1.0" encoding="UTF-8" standalone="yes"?>
<npc xmlns:xsi="http://www.w3.org/2001/XMLSchema-instance" type="RiftInvader" id="21715" xsi:schemaLocation="npc ../../npc.xsd" xsi:noNamespaceSchemaLocation="npc">
    <info aggressive="false" targetable="true" attackable="false">
        <name display="true" send="false">Purgatory Invader Disciples</name>
        <level>53</level>
        <sex>MALE</sex>
        <stats>
            <hp regen="6.5" max="1570.8463"/>
            <mp regen="2.4" max="832.4"/>
            <attack critical="8" evasion="0" range="40">
                <physical speed="253.0" damage="353.71092"/>
                <magical speed="333.0" damage="241.5387"/>
            </attack>
            <defense>
                <physical value="214.18326"/>
                <magical value="142.60563"/>
            </defense>
            <move walk="80.0" run="165.0"/>
            <base wit="20" dex="30" men="20" con="43" str="40" int="21"/>
        </stats>
        <experience>9873</experience>
        <sp>776</sp>
        <item lefthand="946" righthand="946"/>
        <collision heigth="28.5" radius="11.0"/>
    </info>
    <droplist>
        <item chance="700000" max="2660" min="1309" id="57"/>
        <item chance="74" max="1" min="1" id="442"/>
        <item chance="118" max="1" min="1" id="473"/>
        <item chance="162835" max="1" min="1" id="1867"/>
        <item chance="162835" max="1" min="1" id="1872"/>
        <item chance="27139" max="1" min="1" id="1882"/>
        <item chance="4285" max="1" min="1" id="1894"/>
        <item chance="50463" max="1" min="1" id="1987"/>
        <item chance="5867" max="1" min="1" id="1988"/>
        <item chance="9202" max="1" min="1" id="1989"/>
        <item chance="2036" max="1" min="1" id="4042"/>
        <item chance="545813" max="1" min="1" id="4126"/>
        <item chance="81871" max="1" min="1" id="4127"/>
        <item chance="3023" max="1" min="1" id="4127"/>
        <item chance="2827" max="1" min="1" id="8726"/>
        <item chance="707" max="1" min="1" id="8736"/>
        <item chance="71" max="1" min="1" id="8746"/>
        <item chance="14" max="1" min="1" id="8756"/>
    </droplist>
</npc>
