<?xml version="1.0" encoding="UTF-8"?>
<npc type="Monster" id="20134" xsi:schemaLocation="npc ../../npc.xsd"
    xsi:noNamespaceSchemaLocation="npc" xmlns:xsi="http://www.w3.org/2001/XMLSchema-instance">
    <info aggressive="true" targetable="true" attackable="false">
        <name display="true" send="false">Cave Maiden</name>
        <level>59</level>
        <sex>FEMALE</sex>
        <stats>
            <hp regen="6.5" max="1880.92519"/>
            <mp regen="2.4" max="1007.0"/>
            <attack critical="4" evasion="0" range="40">
                <physical speed="253.0" damage="461.94387"/>
                <magical speed="333.0" damage="315.44778"/>
            </attack>
            <defense>
                <physical value="242.81593"/>
                <magical value="161.66959"/>
            </defense>
            <move walk="70.0" run="174.0"/>
            <base wit="20" dex="30" men="20" con="43" str="40" int="21"/>
        </stats>
        <experience>6135</experience>
        <sp>524</sp>
        <item lefthand="0" righthand="68"/>
        <collision heigth="65.0" radius="25.0"/>
    </info>
    <droplist>
        <item chance="700000" max="1673" min="821" id="57"/>
        <item chance="233" max="1" min="1" id="356"/>
        <item chance="10" max="1" min="1" id="357"/>
        <item chance="15" max="1" min="1" id="383"/>
        <item chance="832" max="1" min="1" id="947"/>
        <item chance="20" max="1" min="1" id="947"/>
        <item chance="34121" max="1" min="1" id="1866"/>
        <item chance="693087" max="5" min="1" id="1871"/>
        <item chance="51182" max="1" min="1" id="1871"/>
        <item chance="4265" max="1" min="1" id="1885"/>
        <item chance="10" max="1" min="1" id="2376"/>
        <item chance="15" max="1" min="1" id="2379"/>
        <item chance="445" max="1" min="1" id="4041"/>
        <item chance="1390" max="1" min="1" id="4056"/>
        <item chance="2148" max="1" min="1" id="4057"/>
        <item chance="1390" max="1" min="1" id="4064"/>
        <item chance="2148" max="1" min="1" id="4065"/>
        <item chance="39" max="1" min="1" id="4192"/>
        <item chance="637" max="1" min="1" id="4993"/>
        <item chance="2047" max="1" min="1" id="5220"/>
        <item chance="853" max="1" min="1" id="8728"/>
        <item chance="213" max="1" min="1" id="8738"/>
        <item chance="21" max="1" min="1" id="8748"/>
        <item chance="5" max="1" min="1" id="8758"/>
    </droplist>
</npc>
