<?xml version="1.0" encoding="UTF-8"?>
<npc
    controller="com.l2jserver.model.world.npc.controller.MonsterController"
    id="21414" xsi:schemaLocation="npc ../../npc.xsd"
    xsi:noNamespaceSchemaLocation="npc" xmlns:xsi="http://www.w3.org/2001/XMLSchema-instance">
    <info aggressive="false" targetable="true" attackable="true">
        <name display="true" send="false">Assassin of Empire</name>
        <level>78</level>
        <race>UNDEAD</race>
        <sex>MALE</sex>
        <stats>
            <hp regen="8.721" max="2975.2369188"/>
            <mp regen="3.0804" max="1742.976"/>
            <attack critical="8" evasion="0" range="40">
                <physical speed="253.0" damage="938.20801"/>
                <magical speed="333.0" damage="656.66638"/>
            </attack>
            <defense>
                <physical value="354.81835"/>
                <magical value="239.18092"/>
            </defense>
            <move walk="80.0" run="175.0"/>
            <base wit="20" dex="30" men="20" con="43" str="40" int="21"/>
        </stats>
        <experience>36181</experience>
        <sp>4108</sp>
        <item lefthand="945" righthand="946"/>
        <collision heigth="28.5" radius="11.0"/>
    </info>
    <droplist>
        <item chance="700000" category="DROP" max="10446" min="5101" id="57"/>
        <item chance="153" category="UNK_2" max="1" min="1" id="960"/>
        <item chance="239255" category="UNK_2" max="60" min="20" id="1344"/>
        <item chance="63801" category="UNK_2" max="6" min="2" id="1866"/>
        <item chance="127602" category="UNK_2" max="3" min="1" id="1871"/>
        <item chance="414708" category="SPOIL" max="1" min="1" id="1877"/>
        <item chance="15312" category="UNK_2" max="1" min="1" id="1877"/>
        <item chance="207354" category="SPOIL" max="1" min="1" id="4040"/>
        <item chance="7656" category="UNK_2" max="1" min="1" id="4040"/>
        <item chance="3329" category="UNK_2" max="1" min="1" id="4041"/>
        <item chance="1313" category="UNK_1" max="1" min="1" id="5533"/>
        <item chance="1311" category="UNK_1" max="1" min="1" id="5544"/>
        <item chance="151985" category="SPOIL" max="1" min="1" id="6344"/>
        <item chance="1313" category="UNK_1" max="1" min="1" id="8342"/>
        <item chance="1312" category="UNK_1" max="1" min="1" id="8349"/>
        <item chance="3190" category="UNK_200" max="1" min="1" id="8732"/>
        <item chance="797" category="UNK_200" max="1" min="1" id="8742"/>
        <item chance="80" category="UNK_200" max="1" min="1" id="8752"/>
        <item chance="85" category="UNK_1" max="1" min="1" id="11966"/>
        <item chance="85" category="UNK_1" max="1" min="1" id="11969"/>
        <item chance="85" category="UNK_1" max="1" min="1" id="11970"/>
        <item chance="85" category="UNK_1" max="1" min="1" id="11974"/>
    </droplist>
    <skills>
        <skill level="1" id="4274"/>
        <skill level="13" id="4408"/>
        <skill level="1" id="4409"/>
        <skill level="13" id="4410"/>
        <skill level="13" id="4411"/>
        <skill level="9" id="4412"/>
        <skill level="9" id="4413"/>
        <skill level="2" id="4414"/>
        <skill level="7" id="4415"/>
        <skill level="1" id="4416"/>
        <skill level="9" id="4561"/>
        <skill level="9" id="4603"/>
        <skill level="9" id="4613"/>
        <skill level="7" id="4789"/>
    </skills>
</npc>
