<?xml version="1.0" encoding="UTF-8"?>
<template:npc
    controller="com.l2jserver.model.world.npc.controller.impl.MonsterController"
    id="18792" xsi:schemaLocation="http://schemas.l2jserver2.com/npc ../../npc.xsd"
    xmlns:xsi="http://www.w3.org/2001/XMLSchema-instance" xmlns:template="http://schemas.l2jserver2.com/npc">
    <info aggressive="false" targetable="true" attackable="true">
        <name display="true" send="false">Defeated Troops Javelin Thrower</name>
        <level>80</level>
        <race>DRAGON</race>
        <sex>MALE</sex>
        <stats>
            <hp regen="195.86371266283" max="56659.3136360673"/>
            <mp regen="3.0" max="1674.8"/>
            <attack critical="8" evasion="0" range="1100">
                <physical speed="253.0" damage="9218.40693"/>
                <magical speed="333.0" damage="6294.97689"/>
            </attack>
            <defense>
                <physical value="546.2"/>
                <magical value="599.52818"/>
            </defense>
            <move walk="89.0" run="220.0"/>
            <base wit="20" dex="30" men="20" con="43" str="40" int="21"/>
        </stats>
        <experience>0</experience>
        <sp>0</sp>
        <item lefthand="0" righthand="13843"/>
        <collision heigth="46.5" radius="25.0"/>
    </info>
    <skills>
        <skill level="9" id="4408"/>
        <skill level="1" id="4409"/>
        <skill level="8" id="4410"/>
        <skill level="8" id="4411"/>
        <skill level="7" id="4412"/>
        <skill level="8" id="4413"/>
        <skill level="2" id="4414"/>
        <skill level="9" id="4415"/>
        <skill level="10" id="4416"/>
        <skill level="5" id="4441"/>
        <skill level="1" id="5462"/>
        <skill level="1" id="5837"/>
        <skill level="1" id="5838"/>
    </skills>
</template:npc>
