<?xml version="1.0" encoding="UTF-8"?>
<npc
    controller="com.l2jserver.model.world.npc.controller.BaseNPCController"
    id="13224" xsi:schemaLocation="npc ../npc.xsd"
    xsi:noNamespaceSchemaLocation="npc" xmlns:xsi="http://www.w3.org/2001/XMLSchema-instance">
    <info aggressive="false" targetable="true" attackable="true">
        <name display="true" send="false">Trap</name>
        <level>76</level>
        <race>OTHER</race>
        <stats>
            <hp regen="8.5" max="2758.05923328"/>
            <mp regen="3.0" max="1540.8"/>
            <attack critical="4" evasion="0" range="40">
                <physical speed="253.0" damage="824.42207"/>
                <magical speed="333.0" damage="562.9734"/>
            </attack>
            <defense>
                <physical value="323.78455"/>
                <magical value="236.93149"/>
            </defense>
            <move walk="50.0" run="1.0"/>
            <base wit="20" dex="30" men="20" con="43" str="40" int="21"/>
        </stats>
        <experience>0</experience>
        <sp>0</sp>
        <collision heigth="10.0" radius="5.0"/>
    </info>
    <skills>
        <skill level="1" id="4390"/>
        <skill level="1" id="4408"/>
        <skill level="1" id="4409"/>
        <skill level="11" id="4410"/>
        <skill level="11" id="4411"/>
        <skill level="11" id="4412"/>
        <skill level="11" id="4413"/>
        <skill level="2" id="4414"/>
        <skill level="1" id="4415"/>
        <skill level="19" id="4416"/>
        <skill level="7" id="5269"/>
    </skills>
</npc>
